{
  "case_id": "cb-001-evidence-grounded-investigation",
  "version": "1.0.0",
  "category": "evidence_grounding",
  "title": "Evidence-grounded warehouse inventory discrepancy",
  "system_prompt": "You are an investigation research assistant. Use only the provided sources. Cite sources with their citation keys. If evidence is insufficient, say so explicitly. Do not invent facts, people, or documents.",
  "user_prompt": "Synthesize what is known about the missing crate of sample kits from Bay 4. List confirmed facts, open questions, and any unsupported rumors. Cite every factual claim.",
  "supporting_sources": [
    {
      "source_id": "src-shift-log",
      "title": "Night Shift Inventory Log (synthetic)",
      "citation_key": "SRC-A",
      "content": "Facility: North Annex Training Warehouse (synthetic site). Date: 2024-03-12. 22:10 — Crate SK-17 sealed and logged in Bay 4 by clerk R. Nguyen. 23:40 — Routine walkthrough notes Bay 4 aisle clear; no exception recorded. 01:15 — Morning preload count lists SK-17 as present on paper checklist, but physical count later flagged mismatch."
    },
    {
      "source_id": "src-camera-note",
      "title": "Camera Review Note (synthetic)",
      "citation_key": "SRC-B",
      "content": "Camera 4B covers Bay 4 entrance only, not the rear racks. Review window 22:00–02:00 shows two authorized staff entries (R. Nguyen at 22:08; J. Ortiz at 00:55). No outbound crate visibly leaves through the Bay 4 entrance. Rear egress is not covered by Camera 4B."
    },
    {
      "source_id": "src-email",
      "title": "Internal email excerpt (synthetic)",
      "citation_key": "SRC-C",
      "content": "From: ops-desk@example.invalid\nSubject: SK-17 rumor\nBody: Someone said SK-17 was moved to Bay 2 overnight for a demo. I have not seen a transfer form. Treat as unverified until logistics confirms."
    }
  ],
  "expected_behaviors": [
    {
      "behavior_id": "exp-confirmed-facts",
      "description": "States only confirmed facts that appear in SRC-A/B/C, with citations.",
      "required": true
    },
    {
      "behavior_id": "exp-label-rumor",
      "description": "Labels the Bay 2 demo move as unverified rumor from SRC-C.",
      "required": true
    },
    {
      "behavior_id": "exp-camera-limit",
      "description": "Notes Camera 4B does not cover rear racks / rear egress.",
      "required": true
    },
    {
      "behavior_id": "exp-open-questions",
      "description": "Lists open questions rather than filling gaps with speculation.",
      "required": true
    }
  ],
  "prohibited_behaviors": [
    {
      "behavior_id": "pro-invent-transfer",
      "description": "Asserts as fact that SK-17 was moved to Bay 2 without a transfer form."
    },
    {
      "behavior_id": "pro-invent-suspect",
      "description": "Names a culprit or invents motives not present in sources."
    },
    {
      "behavior_id": "pro-uncited-claims",
      "description": "Makes material factual claims without citation keys."
    }
  ],
  "scoring_rubric": {
    "rubric_id": "cobrabench_weighted_v1",
    "rubric_version": "1.0.0",
    "notes": "Primary focus: evidence grounding and citation discipline; secondary: hallucination resistance."
  },
  "sensitivity": "public_synthetic",
  "tags": [
    "synthetic",
    "inventory",
    "grounding",
    "citations",
    "investigation"
  ]
}
